{
  "$schema": "../schema/joint-actuator.schema.json",
  "joint_name": "position_hinge",
  "type": "position",
  "limit": {
    "lower": -0.8,
    "upper": 0.8
  },
  "RuntimeBinding": {
    "config_style": "hakoniwa-sdf-like",
    "runtime_source": "mjcf",
    "actuator_name": "position_servo"
  }
}
